{
  "schema": 1,
  "comment": "Written by make dependency-review RECORD=1 (scripts/kit/dependency-review.mts) from the registries; make dependency-policy-check compares the checkout with it without a network.",
  "reviewed": "2026-10-15T07:46:12.551Z",
  "locks": [
    {
      "lock": "package-lock.json",
      "sha256": "c8f36955d543dbc961c9144d94a43e75533659a37972367b43252239e8a5fd4b",
      "advisories": [
        {
          "package": "sprintf-js",
          "version": "1.0.3",
          "id": "1241202",
          "severity": "moderate",
          "title": "sprintf-js vulnerable to denial of service through unbounded precision specifiers",
          "url": "https://github.com/advisories/GHSA-hp3w-g68c-fv3c"
        }
      ]
    },
    {
      "lock": "scripts/kit/symbols/go/go.sum",
      "sha256": "b2a9b8d4ce2712108876b91bb86be28c92827d4a2c5179b3afa2b3f79cba307b",
      "advisories": []
    }
  ],
  "dependencies": [
    {
      "ecosystem": "npm",
      "manifest": "package.json",
      "package": "@decimalturn/toml-patch",
      "version": "3.3.0",
      "latest": "3.3.0"
    },
    {
      "ecosystem": "npm",
      "manifest": "package.json",
      "package": "@mdit-vue/shared",
      "version": "3.0.2",
      "latest": "3.0.2"
    },
    {
      "ecosystem": "npm",
      "manifest": "package.json",
      "package": "@microsoft/api-extractor",
      "version": "7.59.4",
      "latest": "7.59.4"
    },
    {
      "ecosystem": "npm",
      "manifest": "package.json",
      "package": "@microsoft/api-extractor-model",
      "version": "7.33.15",
      "latest": "7.33.15"
    },
    {
      "ecosystem": "npm",
      "manifest": "package.json",
      "package": "@renovatebot/pep440",
      "version": "5.0.1",
      "latest": "5.0.1"
    },
    {
      "ecosystem": "npm",
      "manifest": "package.json",
      "package": "acorn",
      "version": "8.19.0",
      "latest": "8.19.0"
    },
    {
      "ecosystem": "npm",
      "manifest": "package.json",
      "package": "acorn-walk",
      "version": "8.3.5",
      "latest": "8.3.5"
    },
    {
      "ecosystem": "npm",
      "manifest": "package.json",
      "package": "ajv",
      "version": "8.20.0",
      "latest": "8.20.0"
    },
    {
      "ecosystem": "npm",
      "manifest": "package.json",
      "package": "amaro",
      "version": "1.2.1",
      "latest": "1.2.1"
    },
    {
      "ecosystem": "npm",
      "manifest": "package.json",
      "package": "eslint-scope",
      "version": "9.1.2",
      "latest": "9.1.2"
    },
    {
      "ecosystem": "npm",
      "manifest": "package.json",
      "package": "github-slugger",
      "version": "2.0.0",
      "latest": "2.0.0"
    },
    {
      "ecosystem": "npm",
      "manifest": "package.json",
      "package": "knip",
      "version": "6.41.0",
      "latest": "6.41.0"
    },
    {
      "ecosystem": "npm",
      "manifest": "package.json",
      "package": "mdast-util-from-markdown",
      "version": "2.1.0",
      "latest": "2.1.0"
    },
    {
      "ecosystem": "npm",
      "manifest": "package.json",
      "package": "mdast-util-frontmatter",
      "version": "2.0.1",
      "latest": "2.0.1"
    },
    {
      "ecosystem": "npm",
      "manifest": "package.json",
      "package": "mdast-util-gfm",
      "version": "3.1.0",
      "latest": "3.1.0"
    },
    {
      "ecosystem": "npm",
      "manifest": "package.json",
      "package": "mdast-util-to-string",
      "version": "4.0.0",
      "latest": "4.0.0"
    },
    {
      "ecosystem": "npm",
      "manifest": "package.json",
      "package": "micromark-extension-frontmatter",
      "version": "2.0.0",
      "latest": "2.0.0"
    },
    {
      "ecosystem": "npm",
      "manifest": "package.json",
      "package": "micromark-extension-gfm",
      "version": "3.0.0",
      "latest": "3.0.0"
    },
    {
      "ecosystem": "npm",
      "manifest": "package.json",
      "package": "oxlint",
      "version": "1.88.0",
      "latest": "1.88.0"
    },
    {
      "ecosystem": "npm",
      "manifest": "package.json",
      "package": "oxlint-tsgolint",
      "version": "7.0.2004",
      "latest": "7.0.2004"
    },
    {
      "ecosystem": "npm",
      "manifest": "package.json",
      "package": "picomatch",
      "version": "4.0.7",
      "latest": "4.0.7"
    },
    {
      "ecosystem": "npm",
      "manifest": "package.json",
      "package": "pip-requirements-js",
      "version": "1.0.3",
      "latest": "1.0.3"
    },
    {
      "ecosystem": "npm",
      "manifest": "package.json",
      "package": "semver",
      "version": "7.8.5",
      "latest": "7.8.5"
    },
    {
      "ecosystem": "npm",
      "manifest": "package.json",
      "package": "shell-quote",
      "version": "1.12.0",
      "latest": "1.12.0"
    },
    {
      "ecosystem": "npm",
      "manifest": "package.json",
      "package": "smol-toml",
      "version": "1.9.1",
      "latest": "1.9.1"
    },
    {
      "ecosystem": "npm",
      "manifest": "package.json",
      "package": "unist-util-visit",
      "version": "5.1.0",
      "latest": "5.1.0"
    },
    {
      "ecosystem": "npm",
      "manifest": "package.json",
      "package": "@types/node",
      "version": "26.6.5",
      "latest": "26.6.5"
    },
    {
      "ecosystem": "npm",
      "manifest": "package.json",
      "package": "@types/picomatch",
      "version": "4.0.3",
      "latest": "4.0.3"
    },
    {
      "ecosystem": "npm",
      "manifest": "package.json",
      "package": "@types/semver",
      "version": "7.8.0",
      "latest": "7.8.0"
    },
    {
      "ecosystem": "npm",
      "manifest": "package.json",
      "package": "@vscode/test-electron",
      "version": "3.1.0",
      "latest": "3.1.0"
    },
    {
      "ecosystem": "npm",
      "manifest": "package.json",
      "package": "jscpd",
      "version": "5.4.1",
      "latest": "5.4.1"
    },
    {
      "ecosystem": "npm",
      "manifest": "package.json",
      "package": "typescript",
      "version": "7.0.2",
      "latest": "7.0.2"
    },
    {
      "ecosystem": "pypi",
      "manifest": "mise.toml",
      "package": "ruff",
      "version": "0.17.0",
      "latest": "0.17.0"
    },
    {
      "ecosystem": "go",
      "manifest": "scripts/kit/symbols/go/go.mod",
      "package": "golang.org/x/tools",
      "version": "v0.52.0",
      "latest": "v0.52.0"
    }
  ],
  "vcs": []
}
